OID_,OBJECTID_1,OBJECTID_2,RS,Partido,Localidad,Direccion,Establecim,CP,Tel,X,Y,CENTER_ID
,"1,779","1,797",V,SAN MIGUEL,San Miguel,Maestro Angel D'Elia  Nª 1674 2do. P of. 8,DOM CARE SRL(Internación Domiciliaria),1663, ,-58.711571999999997,-34.540011800000002,676
,"1,833","1,851",XI,SAN VICENTE,San Vicente,Sarmiento N° 901,Clínica Privada San Vicente,1865,02225-481508,-58.417796000000003,-35.031130089999998,677
,"1,834","1,852",XI,SAN VICENTE,San Vicente,Almirante Brown N° 951,Centro de Día MEDJUGORJE,1865, ,-58.412458090000001,-35.028531600000001,678
,"1,835","1,853",XI,SAN VICENTE,San Vicente,Lavalle N ° 595,Residencia para Adultos Mayores En Familia,1865, ,-58.424134889999998,-35.032493690000003,679
,"1,836","1,854",XI,SAN VICENTE,San Vicente,Eva Peron N° 1692,Sanatorio Privado de Guernica,1865, ,-58.433466000000003,-35.021771389999998,680
,"1,837","1,855",XI,SAN VICENTE,San Vicente,Bolivar N° 131,Geriátrico San Vicente Ferrer,1865, ,-58.424118290000003,-35.025968900000002,681
,"1,838","1,856",XI,SAN VICENTE,San Vicente,Calle 39 N° 230,Geriátrico El Amanecer,1865, ,-58.423757400000000,-35.024169790000002,682
,"1,864","1,882",V,TIGRE,Benavidez,Avenida Marcelo T. de Alvear N°650,Clínica Sagrado Corazón Don Torcuato,1611,011-47415527,-58.712782199999999,-34.412281000000000,683
,"1,865","1,883",V,TIGRE,Benavidez,Avenida Benavidez N° 2371,Consultorios Medicos De Golv,1611, ,-58.695246189999999,-34.410026590000001,684
,"1,866","1,884",V,TIGRE,Benavidez,Moreno N° 2709,Hogar y Centro de Día Apoyos(discapacitados),1611, ,-58.687419990000002,-34.413437690000002,685
,"1,867","1,885",V,TIGRE,Don Torcuato,Avenida Marcelo T. de Alvear N°620,Clínica Privada Don Torcuato,1611, ,-58.627271499999999,-34.493804890000000,686
,"1,868","1,886",V,TIGRE,Don Torcuato,Richieri N° 1600,Clínica Privada de Diagnóstico Dr. Lorefice,1611, ,-58.619499490000003,-34.489671489999999,687
,"1,869","1,887",V,TIGRE,Don Torcuato,Ruta 202  Avenida Angel T. de Alvear N°2646,Centro de Día y Hogar Instituto Un Lugar,1611,011-47915514,-58.627271499999999,-34.493804890000000,688
,"1,885","1,903",V,TIGRE,El Talar de Pacheco,Ruta 197 y Monteagudo N° 2270,Clínica Privada Modelo  de Pacheco S.A.,1618,011-47407014,-58.579658500000001,-34.425086989999997,689
,"1,886","1,904",V,TIGRE,General Pacheco,Boulogne Sur Mer N° 556,Hogar Geriátrico Altos de Pacheco,1617, ,-58.627476999999999,-34.463355190000001,690
,"1,887","1,905",V,TIGRE,General Pacheco,Guayaquil 123,Consultorios Del Casco,1617, ,-58.628688400000001,-34.458849890000003,691
,"1,888","1,906",V,TIGRE,General Pacheco,Hipolito Irigoyen 241,Centro De Diagnostico Y Tratamiento De Baja Y Mediana Complejidad Osecac,1617, ,-58.625489399999999,-34.455364990000000,692
,"1,889","1,907",V,TIGRE,General Pacheco,Boulogne Sur Mer N° 258,C.A.M.E.P. (Consultorios de Atención Médica),1617, ,-58.629432999999999,-34.460875600000001,693
,"1,890","1,908",V,TIGRE,General Pacheco,Jujuy N° 42 e/Avenida Hipolito Irigoyen y Buenos Aires,Di Felice Imágines,1617, ,-58.629358490000001,-34.457519300000001,694
,"1,891","1,909",V,TIGRE,Islas del Delta,Avenida De Los Lagos N° 6785,Centro Médico Nordelta,1648,011-48712222/2223,-58.579658500000001,-34.425086989999997,695
,"1,892","1,910",V,TIGRE,Islas del Delta,Avenida De los Lagos N° 6855 Local 3-Complejo Puerta Norte,Preventive Life,1648, ,-58.579658500000001,-34.425086989999997,696
,"1,893","1,911",V,TIGRE,Rincon de Milberg,Hipolito Irigoyen 1573,Residencia Geriatrica El Talar,1648, ,-58.643281490000000,-34.465131739999997,697
,"1,894","1,912",V,TIGRE,Rincon de Milberg,Santa Maria 2300,Centro Medico Del Plata,1648, ,-58.680457500000003,-34.424695790000001,698
,"1,895","1,913",V,TIGRE,Rincon de Milberg,Santa Maria 2928,Consultorios Delta,1648, ,-58.677772789999999,-34.423254489999998,699
,"1,896","1,914",V,TIGRE,Rincon de Milberg,Jose C. Paz N° 1342,Hogar de Vida y Fortalecimiento Espiritual San Ignacio(Rehabilitación Drogadep.),1648, ,-58.596461990000002,-34.424608190000001,700
,"1,897","1,915",V,TIGRE,Tigre,AvenidaCazon N° 1266,Clínica Privada Ayerza S.A.,1648, ,-58.577032989999999,-34.425578790000003,701
,"1,898","1,916",V,TIGRE,Tigre,Avenida Cazon 1399,Centro Médico Santa Paula,1648,011-47314399,-58.578400889999998,-34.424175300000002,702
,"1,899","1,917",V,TIGRE,Tigre,Avenida Libertador 135,Aerovida,1648, ,-58.582923999999998,-34.421430299999997,703
,"1,900","1,918",V,TIGRE,Tigre,Avenida Dardo Rocha 1473,Tigre Salud SA,1648,011-47490500,-58.582846400000001,-34.427845099999999,704
,"1,927","1,945",VII,TRES DE FEBRERO,Acassuso,Santa Fe N° 1086,Policlinica U.O.C.R.A., ,011-47987027,-58.542955290000002,-34.613847790000001,705
,"1,928","1,946",VII,TRES DE FEBRERO,Caseros,Lisandro Medina N° 2285,Sanatorio Modelo de Caseros,1678,011-47591590/1690/1790,-58.563873700000002,-34.603016699999998,706
,"1,929","1,947",VII,TRES DE FEBRERO,Caseros,Sabatini N° 4776,Clínica Privada San Andrés,B1678,011-47598881,-58.563306400000002,-34.602242990000001,707
,"1,945","1,963",VII,TRES DE FEBRERO,Caseros,Lisandro Medina 2254,Policlinica Anexo Sanatorio Modelo Caseros,1678, ,-58.563592690000000,-34.602728499999998,708
,"1,946","1,964",VII,TRES DE FEBRERO,Caseros,Mitre 3835,Policlinica Privada Ima,1678,011-47504288,-58.552079200000001,-34.613792730000000,709
,"1,947","1,965",VII,TRES DE FEBRERO,Caseros,Mitre N° 4919,Centro de Rehabilitacion y Terapia Fisica Urquiza S.A.,1678,011-47502208,-58.565418630000003,-34.609974190000003,710
,"1,948","1,966",VII,TRES DE FEBRERO,Caseros,Moreno N° 4650,Hospital De Dia San Jose,1678, ,-58.561374499999999,-34.608050759999998,711
,"1,949","1,967",VII,TRES DE FEBRERO,Caseros,Caseros N° 2756,Centro de Día Ocupacional Arco Iris,1678, ,-58.567466400000001,-34.607234890000001,712
,"1,950","1,968",VII,TRES DE FEBRERO,Caseros,Sabattini 4721,Policlinica Privada Central Tres De Febrero,1678, ,-58.562572600000003,-34.602242300000000,713
,"1,951","1,969",VII,TRES DE FEBRERO,Caseros,Wenseslao del Tata 4726 P.A.,Centro de Estudio y Tratamiento de Las Enfermedades Críticas(Hemdiálisis),1678, ,-58.562798000000001,-34.601385989999997,714
,"1,952","1,970",VII,TRES DE FEBRERO,Caseros,Wenceslao De Tata N° 4626,Consultorios Externos Del Sanatorio Modelo De Caseros,1678,011-45127661,-58.560546389999999,-34.601367099999997,715
,"1,953","1,971",VII,TRES DE FEBRERO,Caseros,Wenseslao del Tata 4726,Centro de Ojos San Pablo,1678, ,-58.562798000000001,-34.601385989999997,716
,"1,954","1,972",VII,TRES DE FEBRERO,Caseros,Fischetti N° 4459/61,Escuela de Recuperación Caseros(Centro Educativo Terapéutico),1678, ,-58.557720199999999,-34.600375390000004,717
,"1,955","1,973",VII,TRES DE FEBRERO,Caseros,Avenida San Martin N° 1461,Centro de Atención Primaria Conducir Salud,1678, ,-58.561526960000002,-34.595626050000000,718
,"1,956","1,974",VII,TRES DE FEBRERO,Caseros,3 de Febrero N° 3293,Residencia Geriátrica Pueblo Teggiano,1678, ,-58.564343500000000,-34.613024889999998,719
,"1,957","1,975",VII,TRES DE FEBRERO,Caseros,Moreno N° 4930,Asociación Mutual de Empleados de Comercio-AMEC,1678, ,-58.566220240000000,-34.607840480000000,720
,"1,958","1,976",VII,TRES DE FEBRERO,Caseros,Tres de Febrero N° 2900,PREMERGEN SC(Internación Domiciliaria),1678, ,-58.564053000000001,-34.608961790000002,721
,"1,959","1,977",VII,TRES DE FEBRERO,Caseros,Rauch N° 2215,Centro Médico Comunitario,1678, ,-58.560249300000002,-34.602507000000003,722
,"1,974","1,992",VII,TRES DE FEBRERO,Ciudadela,Hipolito Vieytes N° 371,Centro de Diálisis Fresenius Medical Care,1702, ,-58.542162990000001,-34.644683989999997,723
,"1,975","1,993",VII,TRES DE FEBRERO,Ciudadela,Nolting N° 3826,Asociación Civil Modelo Minnesota Tratamiento y Prevención de Adicciones,1702, ,-58.537795400000000,-34.646421289999999,724
,"1,976","1,994",VII,TRES DE FEBRERO,Ciudadela,Juan B. Justo N° 3835,Hogar Geriátrico Juan B. Justo,1702, ,-58.540278000000001,-34.635673089999997,725
,"1,977","1,995",VII,TRES DE FEBRERO,Ciudadela,Avenida Gaona N° 4316,Grupo FA S.A.(Centro de Diálisis),1702, ,-58.548853389999998,-34.634573099999997,726
,"1,978","1,996",VII,TRES DE FEBRERO,Ciudadela,Buenos Aires N° 4231,Centro de Día Mi Lugar,1702, ,-58.544282889999998,-34.641293990000001,727
,"1,979","1,997",VII,TRES DE FEBRERO,Ciudadela,Republica N° 607,Hogar Geriátrico Angelito,1702, ,-58.554065489999999,-34.636215989999997,728
,"1,980","1,998",VII,TRES DE FEBRERO,Jose Ingenieros,Fray C.Rodriguez N° 2673,Policlinico Privada Dr.Minz,1678, ,-58.536546489999999,-34.619128300000000,729
,"1,981","1,999",VII,TRES DE FEBRERO,Loma Hermosa,Churruca N° 8256,Hogar Para Discapacitados San Francisco,1657,011-48481635,-58.598980990000001,-34.576386200000002,730
,"1,982","2,000",VII,TRES DE FEBRERO,Loma Hermosa,Ruta 8 N° 9062,Consultorios Médicos Anexo Ramón Rial,1657, ,-58.601708790000004,-34.562698789999999,731
,"1,983","2,001",VII,TRES DE FEBRERO,MARTIN CORONADO,Julio Besada N° 6969,Hospital Privado Nuestra Señora de La Merced,1682,011-48425445,-58.587297800000002,-34.583816700000000,732
,"1,984","2,002",VII,TRES DE FEBRERO,MARTIN CORONADO,Azopardo N° 7955,Geriátrico Los Naranjos,1682, ,-58.601487990000003,-34.583914890000003,733
,"1,985","2,003",VII,TRES DE FEBRERO,Pablo Podesta,Benito Perez Galdos N° 9347,Clinica Privada De Salud Mental Santa Maria,1657, ,-58.615421189999999,-34.574949089999997,734
,"1,986","2,004",VII,TRES DE FEBRERO,Saenz Pena,Colon N° 1238,Nuevo Hogar de Saenz Peña SRL,1657, ,-58.531741889999999,-34.604708490000000,735
,"1,987","2,005",VII,TRES DE FEBRERO,Saenz Pena,Moriondo N° 2971,Hogar Geriatrcio Santa Teresita,1657, ,-58.534156000000003,-34.602342589999999,736
,"1,988","2,006",VII,TRES DE FEBRERO,Saenz Pena,Raffo N° 2719,Geriatrico Don Victor,1657, ,-58.526974889999998,-34.601034900000002,737
,"1,989","2,007",VII,TRES DE FEBRERO,Saenz Pena,Rvda. Madre Isabel Fernandez N° 1256,Hogar Geriátrico Santa Bárbara,1674, ,-58.532982390000001,-34.599600289999998,738
,"2,004","2,022",V,VICENTE LOPEZ,Florida,J. M. Paz N°1972,Hospital de Día Comunidad Terapéutica Vicente López,1602, ,-58.484374889999998,-34.542285190000001,739
,"2,005","2,023",V,VICENTE LOPEZ,Florida,Avenida Maipu N° 1964,PARAMEDIC Emergencias Médicas,1602,01157882222,-58.486551589999998,-34.518883090000003,740
,"2,006","2,024",V,VICENTE LOPEZ,Florida,Chacabuco N° 1550/54,Centro de Día Educativo Terapéutico AUPA,1602,011-47183775,-58.489297899999997,-34.526020289999998,741
,"2,007","2,025",V,VICENTE LOPEZ,Florida,Esmeralda N° 1751,Policonsultorios Rodriguez Palacios,1602, ,-58.489886589999998,-34.520752090000002,742
,"2,008","2,026",V,VICENTE LOPEZ,Florida,Chacabuco N° 996,Centro de Otorrinolaringología San Blas Ecumene SA,1602,011-47952796,-58.485691899999999,-34.531070389999996,743
,"2,009","2,027",V,VICENTE LOPEZ,Florida,Sargento Cabral N° 1560,Residencia Geriátrica Mi Hogar,1602, ,-58.509620490000003,-34.536034090000001,744
,"2,010","2,028",V,VICENTE LOPEZ,Florida,Paz N° 1343,Hogar Geriátrico San Jorge,1602, ,-58.478672109999998,-34.539618410000003,745
,"2,011","2,029",V,VICENTE LOPEZ,Florida,Echeverria N° 1764,Residencial Geriátrico Mis Abuelos,1602, ,-58.505847310000000,-34.531559180000002,746
,"2,012","2,030",V,VICENTE LOPEZ,Florida,Laprida 2399,Centro De Rehabilitacion Fisica Kynesium,1602,011-47979346,-58.490905800000000,-34.532949790000004,747
,"2,013","2,031",V,VICENTE LOPEZ,Florida,Blas Parera N° 451,Geriatrico Paeque y Sol,1602, ,-58.496112990000000,-34.542420600000000,748
,"2,014","2,032",V,VICENTE LOPEZ,Florida,Lavalle 2745,Hogar Geriátrico,1602, ,-58.493376789999999,-34.539155600000001,749
,"2,015","2,033",V,VICENTE LOPEZ,Florida,Agustin Alvarez N° 2257,Hogar Geriátrico San Remo,1602, ,-58.486819599999997,-34.537429899999999,750
,"2,016","2,034",V,VICENTE LOPEZ,Florida,A.Alvarez 1568,Clinica De Ojos V. Lopez,1602,011-47962907,-58.479498990000003,-34.534151000000001,751
,"2,017","2,035",V,VICENTE LOPEZ,Florida,Virrey Liniers N° 1464,Geriátrico San Eloy,1602, ,-58.488093689999999,-34.529675300000001,752
,"2,018","2,036",V,VICENTE LOPEZ,Florida,Libertad N° 1645,Centro de Coloproctología y Endoscopía Digestiva,1602, ,-58.487156990000003,-34.523196890000001,753
,"2,019","2,037",V,VICENTE LOPEZ,Florida,Laprida N° 1501 PA,HC Home Care Medicalhelp Servicio de Internación Domiciliaria,1602, ,-58.477958800000003,-34.535435090000000,754
,"2,020","2,038",V,VICENTE LOPEZ,Florida,Espana N° 1549/53,Centro de Medicina Física y Rehabilitación CE.ME.FI.,1602, ,-58.492624300000003,-34.527702189999999,755
,213,213,VI,BERAZATEGUI,Sourigues,Calle 224 N° 890,Centro SHOC (Desintoxicación de Adicciones),1884, ,-58.204454800000001,-34.808804790000003,756
,219,219,XI,LA PLATA,La Plata,Calle 62 N° 334,Centro de Día Bricolage,1923, ,-57.933605860000000,-34.917532760000000,757
,258,258,XI,CANUELAS,Alejandro Petion,Alejandro Magno N° 1495,Fundación IPNA(Instituto Psicopedagógico de Nivelación Aranguren),1814, ,-58.662630900000003,-34.977752690000003,758
,335,335,V,ESCOBAR,Garin,H.Ford esq.Andes,Poloclínica Privada Garin,1619, ,-58.740445100000002,-34.425610689999999,759
,336,336,V,ESCOBAR,Ingeniero  Maschwitz,Colectora Este N° 1131,Policlínica Grupo Médico Maschwitz,1623, ,-58.796684689999999,-34.356745300000000,760
,337,337,V,ESCOBAR,Ingeniero  Maschwitz,Chacabuco N° 1545/1501/1547,Fundación Educativa Arte Terapéutica Especial,1623, ,-58.741694690000003,-34.388019100000001,761
,338,338,V,ESCOBAR,Ingeniero  Maschwitz,Avenida Villanueva N° 1633,Centro de Traumatología y Rehabilitación Maschwitz(Policlínica),1623, ,-58.738999300000003,-34.393181200000001,762
,339,339,V,ESCOBAR,Loma Verde,Conde N° 1140,Fundación Peumayen(hogar y Centro de Día discapacitados mentales),1625, ,-58.784943390000002,-34.340252489999997,763
,340,340,V,ESCOBAR,Loma Verde,Oldman N° 411,Comunidad Terapéutica Belén de Escobar,1625, ,-58.784943390000002,-34.340252489999997,764
,341,341,V,ESCOBAR,Maquinista Savio,Ruta 26 N° 318 ESQ. Juan XXIII,Sanatorio San Carlos,BB1620,03488-466140,-58.753589099999999,-34.382094799999997,765
,342,342,VI,EZEIZA,Canning,Emilio Mitre N° 1974,Hogar de Ancianos Solariega,1842, ,-58.505731789999999,-34.869097699999998,766
,343,343,VI,ESTEBAN ECHEVERRIA,Luis Guillon,Lagos Garcia N°1632,Residencia Parque San Emiliano,1838, ,-58.464985790000000,-34.788865190000003,767
,344,344,VI,ESTEBAN ECHEVERRIA,Luis Guillon,Boulevard Buenos Aires N° 1255,Policlínica P.R.O.E.M.I.,1838, ,-58.450181600000001,-34.811158599999999,768
,345,345,VI,ESTEBAN ECHEVERRIA,Luis Guillon,Teniente Ford N° 1811,Geriátrico Hogar del Carmen,1838, ,-58.447018290000003,-34.802665990000001,769
,346,346,VI,ESTEBAN ECHEVERRIA,Monte Grande,Gral. Rodriguez N° 158,Clinica Privada Monte Grande  S.A,B1842DID,011-42900623/2334/3043/4468,-58.466144389999997,-34.814514289999998,770
,347,347,VI,ESTEBAN ECHEVERRIA,Monte Grande,Avenida H. Irigoyen N° 247,Instituto de Urologia S.R.L.,1842,011-42968256,-58.466686299999999,-34.816079090000002,771
,348,348,VI,ESTEBAN ECHEVERRIA,Monte Grande,Arana N° 256,Centro de Diálisis Fresenius Medical Care,1842, ,-58.465968789999998,-34.813534189999999,772
,367,367,VI,EZEIZA,Canning,Ruta 58-Mariano Castex N° 1925,Centro Médico Canning,1840, ,-58.502348490000003,-34.866834490000002,773
,368,368,VI,EZEIZA,Canning,Mariano Castex N° 1277 Unidad 29 Complejo Comercial Canning Desig,Hospital AT HOME SA(Servicio de Internación Domiciliaria), , ,-58.502781790000000,-34.859521190000002,774
,369,369,VI,EZEIZA,Jose Maria Ezeiza,Balboa  N° 260,Clínica Privada Ezeiza,1804,011-42320141,-58.522861900000002,-34.853732690000001,775
,370,370,VI,EZEIZA,Jose Maria Ezeiza,French N° 530,Diagnóstico Médico Ezeiza (D.I.M.E),1804, ,-58.522861900000002,-34.853732690000001,776
,371,371,VI,EZEIZA,Jose Maria Ezeiza,D. Laure Nª 1009,Centro de Día Fundación Camila Dragone,1804, ,-58.522861900000002,-34.853732690000001,777
,372,372,VI,EZEIZA,Jose Maria Ezeiza,Los Salvadores N° 651,Policonsultorios Asociacion Mutual Empleados  de Comercio filial Ezeiza,1804, ,-58.522861900000002,-34.853732690000001,778
,373,373,VI,EZEIZA,Jose Maria Ezeiza,Vicente Lopez N° 275,Fundacion AME Salud,1840, ,-58.522861900000002,-34.853732690000001,779
,374,374,VI,EZEIZA,Jose Maria Ezeiza,Paso de La Patria N° 194,EZEMED(Policlínica),1840, ,-58.522861900000002,-34.853732690000001,780
,375,375,VI,EZEIZA,Jose Maria Ezeiza,General Racedo N° 188,Centro Educativo Terapéutico Despertares,1840, ,-58.522861900000002,-34.853732690000001,781
,376,376,VI,EZEIZA,Jose Maria Ezeiza,Pbro. Gonzalez y Aragon(Camino Real),Centro Educativo Terapéutico con Equinoterapia Los Angeles del Bosque,1804, ,-58.522861900000002,-34.853732690000001,782
,377,377,VI,EZEIZA,Jose Maria Ezeiza,Rafael Obliogado N° 53 Bo. 1° Justicialista,Instituto Geriátrico Nuestra Señora de Loreto,1804, ,-58.522861900000002,-34.853732690000001,783
,392,392,VI,FLORENCIO VARELA,Florencio Varela,Leon XIII N° 1418,Fundación Programa  Yo Pude (Drogadependientes),1888, ,-58.235324089999999,-34.809606899999999,784
,393,393,VI,FLORENCIO VARELA,Florencio Varela,Mitre N° 268,RADIOMED,1888, ,-58.273388429999997,-34.808806480000001,785
,394,394,VI,FLORENCIO VARELA,Florencio Varela,Aristobulo del Valle N° 1567,Centro de Día CON-VIVIENDO,1888, ,-58.262699890000000,-34.805143389999998,786
,395,395,VI,FLORENCIO VARELA,Florencio Varela,Monteagudo N° 847,Centro de Día F.I.D.M.E.,1888, ,-58.274933689999997,-34.804179189999999,787
,396,396,VI,FLORENCIO VARELA,Florencio Varela,Villarino N° 1615,Geriátrico La Luz Divina,1888, ,-58.276011990000001,-34.796580589999998,788
,397,397,VI,FLORENCIO VARELA,Florencio Varela,Avenida San Martin N° 2072 e/Asuncion y Diagonal Granaderos,Policonsultorios Florencio Varela,1888, ,-58.278608089999999,-34.797118390000001,789
,398,398,VI,FLORENCIO VARELA,Florencio Varela,Monteagudo N° 3256,Cuidados Sileno SRL,1888, ,-58.274662990000003,-34.809471790000003,790
,399,399,VI,FLORENCIO VARELA,Florencio Varela,Luis Braile N° 1348,Centro Educativo Terapéutico Vínculos,1888, ,-58.268494400000002,-34.783324190000002,791
,400,400,VI,FLORENCIO VARELA,Florencio Varela,Mitre N° 40,Centro Ambulatorio de Diagnóstico por Imágines MEDICEN,1888,011-43554833,-58.277596750000001,-34.809062079999997,792
,401,402,VI,FLORENCIO VARELA,Florencio Varela,Aristobulo del Valle N° 1924,Centro Terapéutico del Sur(Centro de Día),1888, ,-58.259234890000002,-34.803223590000002,793
,402,403,VI,FLORENCIO VARELA,Florencio Varela,Velez Sarsfield N° 256,Instituto de Ojos Santa Lucía,1888, ,-58.282465000000002,-34.808301399999998,794
,403,404,VI,FLORENCIO VARELA,VILLA VATTUONE,Dr. C. Galli Mainini(ex Progreso)N° 192,Centro de Investigaciones Médicas CIM(Policlínica),1888, ,-58.276011990000001,-34.796580589999998,795
,404,405,VI,FLORENCIO VARELA,Zeballos,Buenos Aires  N° 50,Clínica Privada Luján,1888,011-42553130,-58.258496919999999,-34.809925419999999,796
,532,544,V,GENERAL SAN MARTIN,General San Martin,Caseros N° 55,Clínica Privada Corporación Médica,1650,011-47547500,-58.540589290000000,-34.556403690000003,797
,533,545,V,GENERAL SAN MARTIN,General San Martin,San Martin N° 104,Centro Neurológico Buenos Aires,1650,011-47556270,-58.563320689999998,-34.563448389999998,798
,534,546,V,GENERAL SAN MARTIN,General San Martin,Felix Ballester N° 2245 PB,Consultorio  Priv. de Radiaciones General San Martín,B1650BNC,011-47522559,-58.542507200000003,-34.577756899999997,799
,535,547,V,GENERAL SAN MARTIN,General San Martin,Güemes N° 2348,Instituto Médico Ginecología y Fertilidad PREFER,1650,011-47131762,-58.544407300000003,-34.577525100000003,800
,536,548,V,GENERAL SAN MARTIN,General San Martin,Avenida Balbin N° 2067,Clínica Privada de Ojos José León Suarez Sucursal San Martín,B1650,011-47549442,-58.542249290000001,-34.580588190000000,801
,537,549,V,GENERAL SAN MARTIN,General San Martin,Pellegrini N° 2051,Policlíca Privada Cefran,1650, ,-58.538955600000001,-34.578091899999997,802
,538,550,V,GENERAL SAN MARTIN,General San Martin,Matheu N° 3575,Departamento de Diagnóstico,1650,011-47556020/542040,-58.537945100000002,-34.574669290000003,803
,539,551,V,GENERAL SAN MARTIN,General San Martin,Calle 54 (Mitre) Entre 81 (Sarmiento) Y 83 (Yapeyu),Centro Medico Binemit Sa,1650, ,-58.536305900000002,-34.575057500000000,804
,540,552,V,GENERAL SAN MARTIN,General San Martin,Calle 85 N° 2207,Centro De Rehabilitacion Cerem,1650, ,-58.538173899999997,-34.574755690000003,805
,541,553,V,GENERAL SAN MARTIN,General San Martin,Ayacucho N° 115 Depto 1,Centro Medico Integral Ayacucho,1650, ,-58.542152100000003,-34.567666690000003,806
,542,554,V,GENERAL SAN MARTIN,General San Martin,Ballester N° 976,Consultorio Privado De Radiaciones General San Martin S.A.,1650,011-47543659,-58.527023600000000,-34.585967599999996,807
,543,555,V,GENERAL SAN MARTIN,General San Martin,Caseros N° 2564,Centro de Día TACYP,1650, ,-58.544793970000001,-34.574596780000000,808
,559,571,V,GENERAL SAN MARTIN,General San Martin,Guemes N° 2222,Policonsultorios Guemes(Policlínica),1650, ,-58.543146690000000,-34.578671100000001,809
,560,572,V,GENERAL SAN MARTIN,General San Martin,Intendente Campos N° 1857,Nutriesencia(Consultorios),1650, ,-58.535315490000002,-34.578412700000001,810
,561,573,V,GENERAL SAN MARTIN,General San Martin,La Madrid N° 819,Centro del Pilar (Internación Domiciliaria),1650, ,-58.536265090000001,-34.593301689999997,811
,562,574,V,GENERAL SAN MARTIN,General San Martin,Felix Ballester N° 2184,Corporación Médica Laboral S.A.(Policlínica),1650, ,-58.541884889999999,-34.578296899999998,812
,563,575,V,GENERAL SAN MARTIN,General San Martin,Ramon Carrillo N° 2550,Centro Kinésico Nuestra Señora de Guadalupe S.R.L.,1650, ,-58.542679900000003,-34.572511700000000,813
,564,576,V,GENERAL SAN MARTIN,General San Martin,Salguero N° 2277,Geriátrico Bonifacini,1650, ,-58.538865600000001,-34.574174900000003,814
,565,577,V,GENERAL SAN MARTIN,Jose Leon Suarez,Diagonal 190 N° 2325,Clínica Privada de Ojos José León Suarez,1655,011-47299390,-58.577313390000000,-34.525224289999997,815
,566,578,V,GENERAL SAN MARTIN,Jose Leon Suarez,Echague N° 7377,Policlínica Privada José León Suarez,1655, ,-58.574855999999997,-34.530620390000003,816
,567,579,V,GENERAL SAN MARTIN,Jose Leon Suarez,Calle (61)Lacroze N° 7259(ex1833),Centro de Día AGALMA,1655, ,-58.574293699999998,-34.531632690000002,817
,568,580,V,GENERAL SAN MARTIN,San Andres,AvenidaPte. Peron N°3601/19,Sanatorio San Andrés,1651,011-47557676/6161,-58.542382289999999,-34.571363200000000,818
,569,581,V,GENERAL SAN MARTIN,San Andres,Adelina Hue N° 3040,Geriatrico Guadalupe,1651, ,-58.543307489999997,-34.563506390000001,819
,570,582,V,GENERAL SAN MARTIN,San Andres,Bolivia N° 2729,Centro Educativo Terapéutico y Consultorios Espacio,1651, ,-58.538993290000001,-34.566275490000002,820
,571,583,V,GENERAL SAN MARTIN,San Andres,Congreso N° 3031,Consultorios San Andrés,1651, ,-58.543271590000003,-34.564504499999998,821
,572,584,V,GENERAL SAN MARTIN,Villa Ballester,Enrique Marengo  N° 3908,Sanatorio Clínica Privada Santa María,01163394600,01163394600,-58.558819489999998,-34.549235699999997,822
,587,599,V,GENERAL SAN MARTIN,Villa Ballester,Cordoba N° 4039,Centro de Día Nepen-Hue,1653, ,-58.548345599999998,-34.554214000000002,823
,588,600,V,GENERAL SAN MARTIN,Villa Ballester,Independencia N° 5182,Belle Epoque Primer Centro Argentino-Cubano de Rehabilitación,1653, ,-58.558666590000001,-34.547429700000002,824
,589,601,V,GENERAL SAN MARTIN,Villa Ballester,Alvear N° 2301,Malacchia Centro de Cirugía Plástica y Medicina Estética(Policlínica),1653, ,-58.550719899999997,-34.546624590000000,825
,590,602,V,GENERAL SAN MARTIN,Villa Ballester,Lavalle N° 2330/32,Hogar Geriátrico Edelweiss,1653, ,-58.552105800000000,-34.545839000000001,826
,591,603,V,GENERAL SAN MARTIN,Villa Ballester,Republica N° 5672,Centro de Día Cumelen,1653, ,-58.557956799999999,-34.540678589999999,827
,592,604,V,GENERAL SAN MARTIN,Villa Ballester,91 ex San Lorenzo N°3701,Hogar Geriátrico Nuestra Casa,1653, ,-58.553991089999997,-34.565632989999997,828
,593,605,V,GENERAL SAN MARTIN,VILLA BERNARDO MONTEAGUDO,Buenos Aires 660,Hogar Geriatrico Alvear Alem,1650, ,-58.565809999999999,-34.560506490000002,829
,594,606,V,GENERAL SAN MARTIN,VILLA BERNARDO MONTEAGUDO,Bianchi N° 1506,Centro de Día Nuevos Logros,1650, ,-58.565809999999999,-34.560506490000002,830
,595,607,V,GENERAL SAN MARTIN,VILLA LIBERTAD,Calle 80(Lacroze) N° 5670,AMN Servicio De Ambulacias Medicas Norte,1650, ,-58.565809999999999,-34.560506490000002,831
,596,608,V,GENERAL SAN MARTIN,Villa Lynch,Buenos Aires N° 4440,Don Esteban (Rehabilitación),1672, ,-58.532425889999999,-34.589864190000000,832
,597,609,V,GENERAL SAN MARTIN,Villa Lynch,Rodriguez Pena N° 4463,Hogar Geriátrico El Amanecer,1672, ,-58.532005900000001,-34.590900400000002,833
,598,610,V,GENERAL SAN MARTIN,VILLA YAPEYU,Avenida Ricardo Balbin N° 2641,Hogar de Día Vitales,1650, ,-58.565809999999999,-34.560506490000002,834
,617,629,VII,HURLINGHAM,William Morris,Villegas N° 2899,Hogar de Ancianos Los Tres,1686, ,-58.665247290000003,-34.588143500000001,835
,618,630,VII,ITUZAINGO,Ituzaingo,Brandsen  N° 2850,Clínica Psiquiátrica Albert Schweitzer,1714,011-46211118,-58.692166600000000,-34.637688290000000,836
,619,631,VII,ITUZAINGO,Ituzaingo,Juncal  N° 258,Policlínica Privada Centro de Ojos Ituzaingó,1714,011-46239212,-58.665503999999999,-34.656814089999997,837
,620,632,VII,ITUZAINGO,Ituzaingo,Atacama N° 864,Clínica Gregorio Marañon(Hogar Geriátrico),1714, ,-58.661284100000003,-34.648829790000001,838
,621,633,VII,ITUZAINGO,Ituzaingo,Mansilla N° 759,C.E.F.O. Centro Estetico Flebologico Oeste),1714, ,-58.666041499999999,-34.657295689999998,839
,622,634,VII,ITUZAINGO,Ituzaingo,Olivera N° 2279,Centro Educativo Terapéutico Ad Gaudium,1714, ,-58.681330889999998,-34.670733390000002,840
